{
  "_schema": "samples",
  "schema_version": 1,
  "request_id": "example-minimal-position-0001",
  "comp": {
    "fps": 24.0,
    "duration_sec": 2.0,
    "width": 1920,
    "height": 1080,
    "pixel_aspect": 1.0,
    "work_area_start_sec": 0.0,
    "work_area_end_sec": 2.0
  },
  "properties": [
    {
      "property": {
        "id": "position.parabolic",
        "match_name": "ADBE Position",
        "display_name": "Position",
        "layer_path": "ExampleLayer",
        "kind": "TwoD_Spatial",
        "dimensions": 2,
        "is_spatial": true,
        "is_separated": false,
        "units_label": "pixels"
      },
      "t_start_sec": 0.0,
      "t_end_sec": 2.0,
      "samples_per_frame": 1,
      "samples": [
        {
          "t_sec": 0.0,
          "v": [
            0.0,
            0.0
          ]
        },
        {
          "t_sec": 0.041667,
          "v": [
            8.333333,
            8.159722
          ]
        },
        {
          "t_sec": 0.083333,
          "v": [
            16.666667,
            15.972222
          ]
        },
        {
          "t_sec": 0.125,
          "v": [
            25.0,
            23.4375
          ]
        },
        {
          "t_sec": 0.166667,
          "v": [
            33.333333,
            30.555556
          ]
        },
        {
          "t_sec": 0.208333,
          "v": [
            41.666667,
            37.326389
          ]
        },
        {
          "t_sec": 0.25,
          "v": [
            50.0,
            43.75
          ]
        },
        {
          "t_sec": 0.291667,
          "v": [
            58.333333,
            49.826389
          ]
        },
        {
          "t_sec": 0.333333,
          "v": [
            66.666667,
            55.555556
          ]
        },
        {
          "t_sec": 0.375,
          "v": [
            75.0,
            60.9375
          ]
        },
        {
          "t_sec": 0.416667,
          "v": [
            83.333333,
            65.972222
          ]
        },
        {
          "t_sec": 0.458333,
          "v": [
            91.666667,
            70.659722
          ]
        },
        {
          "t_sec": 0.5,
          "v": [
            100.0,
            75.0
          ]
        },
        {
          "t_sec": 0.541667,
          "v": [
            108.333333,
            78.993056
          ]
        },
        {
          "t_sec": 0.583333,
          "v": [
            116.666667,
            82.638889
          ]
        },
        {
          "t_sec": 0.625,
          "v": [
            125.0,
            85.9375
          ]
        },
        {
          "t_sec": 0.666667,
          "v": [
            133.333333,
            88.888889
          ]
        },
        {
          "t_sec": 0.708333,
          "v": [
            141.666667,
            91.493056
          ]
        },
        {
          "t_sec": 0.75,
          "v": [
            150.0,
            93.75
          ]
        },
        {
          "t_sec": 0.791667,
          "v": [
            158.333333,
            95.659722
          ]
        },
        {
          "t_sec": 0.833333,
          "v": [
            166.666667,
            97.222222
          ]
        },
        {
          "t_sec": 0.875,
          "v": [
            175.0,
            98.4375
          ]
        },
        {
          "t_sec": 0.916667,
          "v": [
            183.333333,
            99.305556
          ]
        },
        {
          "t_sec": 0.958333,
          "v": [
            191.666667,
            99.826389
          ]
        },
        {
          "t_sec": 1.0,
          "v": [
            200.0,
            100.0
          ]
        },
        {
          "t_sec": 1.041667,
          "v": [
            208.333333,
            99.826389
          ]
        },
        {
          "t_sec": 1.083333,
          "v": [
            216.666667,
            99.305556
          ]
        },
        {
          "t_sec": 1.125,
          "v": [
            225.0,
            98.4375
          ]
        },
        {
          "t_sec": 1.166667,
          "v": [
            233.333333,
            97.222222
          ]
        },
        {
          "t_sec": 1.208333,
          "v": [
            241.666667,
            95.659722
          ]
        },
        {
          "t_sec": 1.25,
          "v": [
            250.0,
            93.75
          ]
        },
        {
          "t_sec": 1.291667,
          "v": [
            258.333333,
            91.493056
          ]
        },
        {
          "t_sec": 1.333333,
          "v": [
            266.666667,
            88.888889
          ]
        },
        {
          "t_sec": 1.375,
          "v": [
            275.0,
            85.9375
          ]
        },
        {
          "t_sec": 1.416667,
          "v": [
            283.333333,
            82.638889
          ]
        },
        {
          "t_sec": 1.458333,
          "v": [
            291.666667,
            78.993056
          ]
        },
        {
          "t_sec": 1.5,
          "v": [
            300.0,
            75.0
          ]
        },
        {
          "t_sec": 1.541667,
          "v": [
            308.333333,
            70.659722
          ]
        },
        {
          "t_sec": 1.583333,
          "v": [
            316.666667,
            65.972222
          ]
        },
        {
          "t_sec": 1.625,
          "v": [
            325.0,
            60.9375
          ]
        },
        {
          "t_sec": 1.666667,
          "v": [
            333.333333,
            55.555556
          ]
        },
        {
          "t_sec": 1.708333,
          "v": [
            341.666667,
            49.826389
          ]
        },
        {
          "t_sec": 1.75,
          "v": [
            350.0,
            43.75
          ]
        },
        {
          "t_sec": 1.791667,
          "v": [
            358.333333,
            37.326389
          ]
        },
        {
          "t_sec": 1.833333,
          "v": [
            366.666667,
            30.555556
          ]
        },
        {
          "t_sec": 1.875,
          "v": [
            375.0,
            23.4375
          ]
        },
        {
          "t_sec": 1.916667,
          "v": [
            383.333333,
            15.972222
          ]
        },
        {
          "t_sec": 1.958333,
          "v": [
            391.666667,
            8.159722
          ]
        },
        {
          "t_sec": 2.0,
          "v": [
            400.0,
            0.0
          ]
        }
      ]
    }
  ],
  "config": {
    "tolerance": 1.0,
    "allow_hold": true,
    "allow_linear": true,
    "allow_bezier": true,
    "solve_optimization_mode": "full"
  }
}
